[
	{
		"id": "san-pablo",
		"name": "San Pablo",
		"coordinates": [
			-70.7247,
			-33.4252
		],
		"lines": [
			"L1",
			"L5"
		],
		"inauguratedAt": "1975-09-15",
		"commune": "Lo Prado",
		"history": "Terminal poniente original del Metro. Severamente incendiada en octubre 2019 durante el estallido social, reabierta en julio 2020.",
		"nameOrigin": "Nombrada por la Avenida San Pablo, antiguo Camino a Valparaíso, que recuerda a Pablo de Tarso, apóstol del cristianismo.",
		"curiosity": "Fue escenario de uno de los primeros atentados terroristas del Metro en 1983.",
		"isTransfer": true,
		"isTerminal": true,
		"isAccessible": true,
		"sources": [
			"wikipedia-l1",
			"wikipedia-historia"
		]
	},
	{
		"id": "neptuno",
		"name": "Neptuno",
		"coordinates": [
			-70.7156,
			-33.4282
		],
		"lines": [
			"L1"
		],
		"inauguratedAt": "1975-09-15",
		"commune": "Lo Prado",
		"history": "Estación en trinchera ubicada junto a los Talleres Neptuno, donde se realiza el mantenimiento de los trenes.",
		"nameOrigin": "Por la Avenida Neptuno, que evoca al dios romano del mar de la mitología latina.",
		"isTransfer": false,
		"isTerminal": false,
		"isAccessible": true,
		"sources": [
			"wikipedia-l1"
		]
	},
	{
		"id": "pajaritos",
		"name": "Pajaritos",
		"coordinates": [
			-70.7134,
			-33.4578
		],
		"lines": [
			"L1"
		],
		"inauguratedAt": "1975-09-15",
		"commune": "Lo Prado",
		"history": "Estación intermodal importante que conecta con buses hacia el aeropuerto Arturo Merino Benítez y Valparaíso.",
		"nameOrigin": "Según la tradición popular, los carretones de semillas transitaban por este camino rural y las semillas caían por los baches, atrayendo a pequeños pájaros que las comían.",
		"curiosity": "El nombre evoca el comercio histórico en la ruta colonial hacia la costa.",
		"isTransfer": false,
		"isTerminal": false,
		"isAccessible": true,
		"sources": [
			"wikipedia-pajaritos",
			"wikipedia-l1"
		]
	},
	{
		"id": "las-rejas",
		"name": "Las Rejas",
		"coordinates": [
			-70.7018,
			-33.4344
		],
		"lines": [
			"L1"
		],
		"inauguratedAt": "1975-09-15",
		"commune": "Lo Prado/Estación Central",
		"history": "Aquí comenzaron las obras del Metro de Santiago el 29 de mayo de 1969, marcando el inicio de la construcción del sistema.",
		"nameOrigin": "Por el antiguo Fundo Las Rejas que ocupaba gran parte del sector durante la época colonial.",
		"curiosity": "Primera palada del Metro de Santiago se dio en este lugar.",
		"isTransfer": false,
		"isTerminal": false,
		"isAccessible": true,
		"sources": [
			"wikipedia-l1",
			"lub-upc"
		]
	},
	{
		"id": "ecuador",
		"name": "Ecuador",
		"coordinates": [
			-70.6901,
			-33.4381
		],
		"lines": [
			"L1"
		],
		"inauguratedAt": "1975-09-15",
		"commune": "Estación Central",
		"history": "Estación del tramo fundacional que sirve al barrio con nomenclatura latinoamericana.",
		"nameOrigin": "Por la Calle Ecuador, parte de la nomenclatura de calles del sector que honra a países latinoamericanos.",
		"isTransfer": false,
		"isTerminal": false,
		"isAccessible": true,
		"sources": [
			"wikipedia-l1"
		]
	},
	{
		"id": "san-alberto-hurtado",
		"name": "San Alberto Hurtado",
		"coordinates": [
			-70.6922,
			-33.4542
		],
		"lines": [
			"L1"
		],
		"inauguratedAt": "1975-09-15",
		"commune": "Estación Central",
		"formerName": "Pila del Ganso (1975-2005)",
		"history": "Originalmente llamada \"Pila del Ganso\". Renombrada en 2005 tras la canonización del Padre Hurtado.",
		"nameOrigin": "Honra a San Alberto Hurtado Cruchaga (1901-1952), sacerdote jesuita chileno canonizado en 2005, fundador del Hogar de Cristo ubicado en las cercanías.",
		"curiosity": "El nombre original \"Pila del Ganso\" provenía de una fuente colonial con una figura de ganso que existía en el sector.",
		"isTransfer": false,
		"isTerminal": false,
		"isAccessible": true,
		"sources": [
			"wikipedia-l1"
		]
	},
	{
		"id": "universidad-de-santiago",
		"name": "Universidad de Santiago",
		"coordinates": [
			-70.6845,
			-33.4502
		],
		"lines": [
			"L1"
		],
		"inauguratedAt": "1975-09-15",
		"commune": "Estación Central",
		"history": "Sirve al campus principal de la Universidad de Santiago de Chile (USACH), una de las principales universidades estatales del país.",
		"nameOrigin": "Por la Universidad de Santiago de Chile (USACH), cuyo campus principal se ubica junto a la estación.",
		"isTransfer": false,
		"isTerminal": false,
		"isAccessible": true,
		"sources": [
			"wikipedia-l1"
		]
	},
	{
		"id": "estacion-central",
		"name": "Estación Central",
		"coordinates": [
			-70.6799,
			-33.4508
		],
		"lines": [
			"L1"
		],
		"inauguratedAt": "1975-09-15",
		"commune": "Estación Central",
		"history": "Nodo crítico de intermodalidad con el ferrocarril al sur (EFE Tren Central). Su arquitectura subterránea dialoga con la gran estructura de acero de la estación de trenes en superficie.",
		"nameOrigin": "Por la Estación Central de Ferrocarriles, el principal terminal ferroviario de Chile inaugurado en 1884. La comuna adoptó el nombre de la estación.",
		"curiosity": "La estación de trenes sobre ella presenta una estructura metálica de la época, y es Monumento Nacional.",
		"architect": "Juan Parrochia Beguin",
		"dailyPassengers": 65000,
		"isTransfer": false,
		"isTerminal": false,
		"isAccessible": true,
		"sources": [
			"wikipedia-l1",
			"la-tercera-himmel"
		]
	},
	{
		"id": "union-latinoamericana",
		"name": "Unión Latinoamericana",
		"coordinates": [
			-70.6715,
			-33.4478
		],
		"lines": [
			"L1"
		],
		"inauguratedAt": "1975-09-15",
		"commune": "Santiago",
		"history": "Estación del tramo fundacional en el sector poniente del centro de Santiago.",
		"nameOrigin": "Por la calle homónima que expresa el ideal de integración de los pueblos de América Latina.",
		"isTransfer": false,
		"isTerminal": false,
		"isAccessible": true,
		"sources": [
			"wikipedia-l1"
		]
	},
	{
		"id": "republica",
		"name": "República",
		"coordinates": [
			-70.6655,
			-33.4458
		],
		"lines": [
			"L1"
		],
		"inauguratedAt": "1975-09-15",
		"commune": "Santiago",
		"history": "Sirve al tradicional barrio universitario de República, con múltiples sedes universitarias.",
		"nameOrigin": "Por la Avenida República, que honra la forma de gobierno republicana de Chile.",
		"isTransfer": false,
		"isTerminal": false,
		"isAccessible": true,
		"sources": [
			"wikipedia-l1"
		]
	},
	{
		"id": "los-heroes",
		"name": "Los Héroes",
		"coordinates": [
			-70.6575,
			-33.4468
		],
		"lines": [
			"L1",
			"L2"
		],
		"inauguratedAt": "1975-09-15",
		"commune": "Santiago",
		"history": "Primera estación de combinación de la red. Sobre ella se encuentra el Paseo de los Héroes con estatuas de figuras militares.",
		"nameOrigin": "Por el Monumento a los Héroes de La Concepción, encargado en 1920 a la escultora Rebeca Matte para honrar a los 77 soldados caídos en la Batalla de La Concepción (1882) durante la Guerra del Pacífico.",
		"architect": "Juan Parrochia Beguin",
		"dailyPassengers": 110000,
		"isTransfer": true,
		"isTerminal": false,
		"isAccessible": true,
		"sources": [
			"wikipedia-l1",
			"wikipedia-l2"
		]
	},
	{
		"id": "la-moneda",
		"name": "La Moneda",
		"coordinates": [
			-70.6538,
			-33.4423
		],
		"lines": [
			"L1"
		],
		"inauguratedAt": "1975-09-15",
		"commune": "Santiago",
		"history": "Terminal del primer tramo inaugurado. Concebida como la estación institucional por excelencia, ubicada bajo el palacio de gobierno. Alberga murales de Guillermo Muñoz Vera.",
		"nameOrigin": "Recibe su nombre del Palacio de La Moneda, sede del poder ejecutivo de Chile, ubicado sobre la estación.",
		"curiosity": "El nombre del palacio proviene de que originalmente fue la Casa de Moneda, donde se acuñaban las monedas del reino desde el siglo XVIII.",
		"architect": "Juan Parrochia Beguin",
		"dailyPassengers": 45000,
		"isTransfer": false,
		"isTerminal": false,
		"isAccessible": true,
		"sources": [
			"wikipedia-l1",
			"somos-tour"
		]
	},
	{
		"id": "universidad-de-chile",
		"name": "Universidad de Chile",
		"coordinates": [
			-70.6494,
			-33.4418
		],
		"lines": [
			"L1",
			"L3"
		],
		"inauguratedAt": "1977-03-31",
		"commune": "Santiago",
		"history": "Alberga el mural \"Memoria Visual de una Nación\" de Mario Toral, obra cumbre de 1.200 m² que narra la historia de Chile. Reconocida por Lonely Planet y BBC como una de las estaciones más artísticas del mundo.",
		"nameOrigin": "Por la Casa Central de la Universidad de Chile, la universidad más antigua del país fundada en 1842, ubicada frente a la estación.",
		"curiosity": "El mural de Toral se divide en \"Pasado\" (conquista, violencia) y \"Presente/Futuro\" (modernidad, poesía). Es el mural más grande de Latinoamérica.",
		"pictogram": "Fachada de la Casa Central",
		"architect": "Juan Parrochia Beguin",
		"dailyPassengers": 85000,
		"isTransfer": true,
		"isTerminal": false,
		"isAccessible": true,
		"sources": [
			"wikipedia-l1",
			"somos-tour",
			"lonely-planet"
		]
	},
	{
		"id": "santa-lucia",
		"name": "Santa Lucía",
		"coordinates": [
			-70.6449,
			-33.4408
		],
		"lines": [
			"L1"
		],
		"inauguratedAt": "1977-03-31",
		"commune": "Santiago",
		"history": "Ubicada junto al Cerro Santa Lucía y la Biblioteca Nacional de Chile. Futura combinación con Línea 9.",
		"nameOrigin": "Por el Cerro Santa Lucía, llamado \"Huelén\" por los pueblos originarios y renombrado por Pedro de Valdivia, quien desde su cima fundó Santiago el 12 de febrero de 1541.",
		"isTransfer": false,
		"isTerminal": false,
		"isAccessible": true,
		"sources": [
			"wikipedia-l1",
			"wikipedia-santa-lucia"
		]
	},
	{
		"id": "universidad-catolica",
		"name": "Universidad Católica",
		"coordinates": [
			-70.6399,
			-33.4411
		],
		"lines": [
			"L1"
		],
		"inauguratedAt": "1977-03-31",
		"commune": "Santiago",
		"history": "Sirve a la Casa Central de la Pontificia Universidad Católica de Chile, ubicada sobre la estación.",